{
  "$schema": "../artifact-contracts/space-definition.schema.json",
  "example": true,
  "authority": "non_authoritative_example",
  "space_id": "isolated_school",
  "title": "Isolated School",
  "version": "1.0.0",
  "description": "Example Space for local learning, media, schoolwork, guidance, and restricted administration. Product contributions remain independently owned and can retain standalone operation outside this Space.",
  "default_module_id": "space_home",
  "module_instances": [
    {
      "module_id": "space_home",
      "manifest_ref": "manifests/space-home.module-interface.json",
      "enabled": true,
      "required": true,
      "order": 0,
      "public_label": "Home",
      "public_icon_ref": "icons/home.svg",
      "home_route_override": null
    },
    {
      "module_id": "uckk_learning",
      "manifest_ref": "manifests/uckk-learning.module-interface.json",
      "enabled": true,
      "required": true,
      "order": 10,
      "public_label": "Learn",
      "public_icon_ref": "icons/learn.svg",
      "home_route_override": null
    },
    {
      "module_id": "koa_mediatheque",
      "manifest_ref": "manifests/koa-mediatheque.module-interface.json",
      "enabled": true,
      "required": true,
      "order": 20,
      "public_label": "Library",
      "public_icon_ref": "icons/library.svg",
      "home_route_override": null
    },
    {
      "module_id": "orgo_schoolwork",
      "manifest_ref": "manifests/orgo-schoolwork.module-interface.json",
      "enabled": true,
      "required": false,
      "order": 30,
      "public_label": "Assignments",
      "public_icon_ref": "icons/assignments.svg",
      "home_route_override": null
    },
    {
      "module_id": "ariane",
      "manifest_ref": "manifests/ariane.module-interface.json",
      "enabled": true,
      "required": false,
      "order": 40,
      "public_label": "Guidance",
      "public_icon_ref": "icons/guidance.svg",
      "home_route_override": null
    },
    {
      "module_id": "koa_administration",
      "manifest_ref": "manifests/koa-administration.module-interface.json",
      "enabled": true,
      "required": false,
      "order": 50,
      "public_label": "Administration",
      "public_icon_ref": "icons/administration.svg",
      "home_route_override": null
    }
  ],
  "global_topbar": [
    {
      "widget_id": "global.search",
      "module_id": null,
      "scope": "global",
      "slot": "primary",
      "kind": "search",
      "label": "Search",
      "label_key": "global.search",
      "icon_ref": "icons/search.svg",
      "priority": 10,
      "required_capabilities": [],
      "offline_behavior": "available",
      "compact_only": true,
      "activation": {
        "kind": "route",
        "route_id": "global.search"
      }
    },
    {
      "widget_id": "global.network_state",
      "module_id": null,
      "scope": "global",
      "slot": "status",
      "kind": "status",
      "label": "Network state",
      "label_key": "global.network_state",
      "icon_ref": "icons/network.svg",
      "priority": 20,
      "required_capabilities": [],
      "offline_behavior": "available",
      "compact_only": true,
      "activation": {
        "kind": "none"
      },
      "projection_ref": "space_home.network_state"
    },
    {
      "widget_id": "global.ariane",
      "module_id": null,
      "scope": "global",
      "slot": "secondary",
      "kind": "action",
      "label": "Ariane",
      "label_key": "global.ariane",
      "icon_ref": "icons/ariane.svg",
      "priority": 30,
      "required_capabilities": [
        "ariane_access"
      ],
      "offline_behavior": "degraded",
      "compact_only": true,
      "activation": {
        "kind": "route",
        "route_id": "ariane.home"
      }
    }
  ],
  "appearance": {
    "theme_ref": "themes/school-default.json",
    "logo_ref": "branding/school-logo.svg",
    "design_system_id": "koali_spaces",
    "theme_version": "1.0.0"
  },
  "offline_policy": {
    "shell_available": true,
    "retain_last_validated_definition": true,
    "unavailable_module_behavior": "show_declared_fallback",
    "network_state_indicator": true,
    "public_cdn_required": false,
    "remote_runtime_assets_required": false
  },
  "assignment_scope": "organization",
  "authority_boundary": {
    "presentation_only": true,
    "may_grant_capabilities": false,
    "contains_business_state": false,
    "contains_executable_extension": false
  },
  "appearance_policy": {
    "default_mode": "system",
    "default_accent": "forest",
    "default_density": "touch",
    "default_surface_style": "outlined",
    "allowed_modes": [
      "system",
      "light",
      "dark"
    ],
    "allowed_accents": [
      "forest",
      "ocean",
      "slate",
      "earth",
      "plum"
    ],
    "allowed_densities": [
      "compact",
      "comfortable",
      "touch"
    ],
    "allowed_surface_styles": [
      "minimal",
      "outlined",
      "elevated"
    ],
    "allow_module_accent": true
  }
}
