{
  "$schema": "../../../docs/contracts/artifact-contracts/space-definition.schema.json",
  "space_id": "default_space",
  "title": "Default Space",
  "version": "1.0.0",
  "description": "Minimal local Space containing only the admitted Koali Spaces home contribution. Integrated products remain independently owned and are discovered through admitted manifests rather than a hard-coded product runtime dependency.",
  "default_module_id": "space_home",
  "module_instances": [
    {
      "module_id": "space_home",
      "manifest_ref": "global-widgets.json",
      "enabled": true,
      "required": true,
      "order": 0,
      "public_label": "Home",
      "public_icon_ref": "icons/home.svg",
      "home_route_override": null
    }
  ],
  "global_topbar": [],
  "appearance": {
    "theme_ref": "themes/default.json",
    "logo_ref": null,
    "design_system_id": "koali.ant5",
    "theme_version": "1.0.0"
  },
  "offline_policy": {
    "shell_available": true,
    "retain_last_validated_definition": true,
    "unavailable_module_behavior": "show_declared_fallback",
    "network_state_indicator": true,
    "public_cdn_required": false,
    "remote_runtime_assets_required": false
  },
  "assignment_scope": "installation",
  "authority_boundary": {
    "presentation_only": true,
    "may_grant_capabilities": false,
    "contains_business_state": false,
    "contains_executable_extension": false
  },
  "appearance_policy": {
    "default_mode": "system",
    "default_accent": "forest",
    "default_density": "comfortable",
    "default_surface_style": "outlined",
    "allowed_modes": [
      "system",
      "light",
      "dark"
    ],
    "allowed_accents": [
      "forest",
      "ocean",
      "slate",
      "earth",
      "plum"
    ],
    "allowed_densities": [
      "compact",
      "comfortable",
      "touch"
    ],
    "allowed_surface_styles": [
      "minimal",
      "outlined",
      "elevated"
    ],
    "allow_module_accent": true
  }
}
